{
  "schema_version": "hum.math_obligation.v0",
  "obligation_id": "hum_obl_allocation_free_build_packet",
  "obligation_kind": "allocation_freedom",
  "source_span": {
    "file": "src/packet.hum",
    "start_line": 31,
    "start_column": 1,
    "end_line": 48,
    "end_column": 2
  },
  "graph_node_id": "hum_sem_node_build_packet",
  "claim_text": "build_packet is allocation-free.",
  "normalized_formal_claim": {
    "representation": "hum_static_claim_v0",
    "expression": "heap_allocations(build_packet) == 0",
    "variables": [
      {
        "name": "heap_allocations",
        "sort": "nat"
      }
    ],
    "expected_bound": "0"
  },
  "assumptions": [
    {
      "assumption_id": "assume_packet_builder_calls_are_visible",
      "evidence_class": "compiler_fact",
      "text": "The semantic graph includes direct calls made by build_packet.",
      "source_ref": "hum_graph:hum_sem_node_build_packet"
    }
  ],
  "allowed_effects": ["read_memory", "write_local_memory", "heap_allocate"],
  "program_shape": {
    "primary": "streaming_sequential",
    "access_pattern": "sequential",
    "mutation": "local",
    "io": "none",
    "concurrency": "single_threaded",
    "hardware": "abstract"
  },
  "resource_model": {
    "machine_model": "hum_abstract_machine_v0",
    "word_bits": 64,
    "integer_overflow": "checked",
    "allocation_model": "heap",
    "peak_memory_unit": "bytes"
  },
  "confidence_requested": "counterexample_search",
  "timeout_budget": {
    "timeout_ms": 1000,
    "max_solver_memory_bytes": 67108864,
    "max_steps": 10000
  },
  "privacy": {
    "local_first": true,
    "network_access": "none",
    "cloud_access": "none",
    "telemetry": "none"
  }
}
